{
  "artifact_type": "v17_attribute_resolution_oracle_catalog",
  "schema_version": 1,
  "oracle_collection_id": "ota_ward_attribute_resolution_v17_oracles_v1",
  "policy_id": "ota_ward_attribute_resolution_policy_v17",
  "independence": {
    "authored_from_normative_specification": true,
    "production_code_used_to_derive_expected_values": false,
    "production_output_compared_during_authoring": false,
    "oracle_author_role": "production_independent_oracle_author",
    "reviewer_role": "specification_conformance_reviewer",
    "relationship_to_production_implementation": "independent"
  },
  "oracles": [
    {"oracle_id":"OR-V17-001","outcome":"resolved","resolution_status":"resolved","value_origin":"rule_derived","effective_value":{"oneway":"no","directions":["forward","backward"]},"stop_code":null,"assertions":["OSM_ONEWAY_ABSENT_DEFAULT_NO is recorded","source absence remains auditable"]},
    {"oracle_id":"OR-V17-002","outcome":"resolved","resolution_status":"resolved","value_origin":"source_explicit","effective_value":{"oneway":"yes","directions":["forward"]},"stop_code":null,"assertions":["forward only"]},
    {"oracle_id":"OR-V17-003","outcome":"resolved","resolution_status":"resolved","value_origin":"source_explicit","effective_value":{"oneway":"no","directions":["forward","backward"]},"stop_code":null,"assertions":["both canonical directions share one source interval"]},
    {"oracle_id":"OR-V17-004","outcome":"resolved","resolution_status":"resolved","value_origin":"source_explicit","effective_value":{"oneway":"-1","directions":["backward"]},"stop_code":null,"assertions":["source node order is unchanged","travel geometry is reversed only for materialization"]},
    {"oracle_id":"OR-V17-005","outcome":"resolved","resolution_status":"resolved","value_origin":"rule_derived","effective_value":{"oneway":"yes","directions":["forward"]},"stop_code":null,"assertions":["registered implicit rule provenance is retained"]},
    {"oracle_id":"OR-V17-006","outcome":"resolved","resolution_status":"resolved","value_origin":"source_explicit","effective_value":{"forward":2,"backward":2,"both_ways":0},"stop_code":null,"assertions":["formal directional allocation is explicit"]},
    {"oracle_id":"OR-V17-007","outcome":"resolved","resolution_status":"resolved","value_origin":"source_explicit","effective_value":{"total":5,"forward":2,"backward":2,"both_ways":1},"stop_code":null,"assertions":["5 equals 2 plus 2 plus 1"]},
    {"oracle_id":"OR-V17-008","outcome":"resolved","resolution_status":"resolved","value_origin":"model_assumed","effective_value":{"forward":2,"backward":2},"stop_code":null,"assertions":["BIDIRECTIONAL_EVEN_LANE_EQUAL_SPLIT_V1 is recorded","formal eligibility is false"]},
    {"oracle_id":"OR-V17-009","outcome":"resolved","resolution_status":"resolved","value_origin":"source_explicit","effective_value":{"forward_kmh":50,"backward_kmh":40},"stop_code":null,"assertions":["directional asymmetry is preserved"]},
    {"oracle_id":"OR-V17-010","outcome":"resolved","resolution_status":"resolved","value_origin":"rule_derived","effective_value":{"speed_kmh":40},"stop_code":null,"assertions":["fixture registry version and rule provenance are required"]},
    {"oracle_id":"OR-V17-011","outcome":"resolved","resolution_status":"resolved","value_origin":"source_explicit","effective_value":"allowed","stop_code":null,"assertions":["general access covers delivery"]},
    {"oracle_id":"OR-V17-012","outcome":"resolved","resolution_status":"resolved","value_origin":"source_explicit","effective_value":"allowed","stop_code":null,"assertions":["goods subset dominates general access for delivery"]},
    {"oracle_id":"OR-V17-013","outcome":"resolved","resolution_status":"resolved","value_origin":"source_explicit","effective_value":"denied","stop_code":null,"assertions":["forward scope does not affect backward"]},
    {"oracle_id":"OR-V17-014","outcome":"resolved","resolution_status":"resolved","value_origin":"source_explicit","effective_value":"denied","stop_code":null,"assertions":["lane position one is local and provenance is not copied"]},
    {"oracle_id":"OR-V17-015","outcome":"resolved","resolution_status":"resolved","value_origin":"source_explicit","effective_value":"denied","stop_code":null,"assertions":["registered condition matches scenario context"]},
    {"oracle_id":"OR-V17-016","outcome":"resolved","resolution_status":"resolved","value_origin":"rule_derived","effective_value":"allowed","stop_code":null,"assertions":["both maximal rule IDs are retained","effect is adopted once"]},
    {"oracle_id":"OR-V17-017","outcome":"resolved","resolution_status":"resolved","value_origin":"rule_derived","effective_value":"ds:1001:0:2:forward","stop_code":null,"assertions":["one candidate is adopted"]},
    {"oracle_id":"OR-V17-018","outcome":"accounted","resolution_status":"resolved","value_origin":"rule_derived","effective_value":{"materialization_omission":true,"permission_set":[]},"stop_code":null,"assertions":["omission is not exclusion","tuple remains in completeness denominator"]},
    {"oracle_id":"OR-V17-019","outcome":"accounted","resolution_status":null,"value_origin":null,"effective_value":{"input":10,"governed":9,"excluded":1},"stop_code":null,"assertions":["input equals governed plus excluded"]},
    {"oracle_id":"OR-V17-020","outcome":"resolved","resolution_status":"resolved","value_origin":"rule_derived","effective_value":{"canonical_origin":"rule_derived"},"stop_code":null,"assertions":["v17 writer does not emit value_state"]},
    {"oracle_id":"OR-V17-021","outcome":"resolved","resolution_status":"resolved","value_origin":"rule_derived","effective_value":"denied","stop_code":null,"assertions":["known false authorization is denied rather than missing"]},
    {"oracle_id":"OR-V17-022","outcome":"resolved","resolution_status":"resolved","value_origin":"source_explicit","effective_value":["50","","40"],"stop_code":null,"assertions":["explicit empty lane value is retained","vector length is three"]},
    {"oracle_id":"OR-V17-023","outcome":"stopped","resolution_status":"valid_but_unsupported","value_origin":null,"effective_value":null,"stop_code":"LEGACY_STATE_MAPPING_UNSUPPORTED","assertions":["mapping is not inferred"]},
    {"oracle_id":"OR-V17-024","outcome":"stopped","resolution_status":"invalid","value_origin":null,"effective_value":null,"stop_code":"ONEWAY_VALUE_INVALID","assertions":["invalid explicit value is retained for audit"]},
    {"oracle_id":"OR-V17-025","outcome":"stopped","resolution_status":"valid_but_unsupported","value_origin":null,"effective_value":null,"stop_code":"ONEWAY_VALUE_UNSUPPORTED","assertions":["unsupported value is not defaulted"]},
    {"oracle_id":"OR-V17-026","outcome":"stopped","resolution_status":"unresolved","value_origin":null,"effective_value":null,"stop_code":"ONEWAY_RULE_NOT_REGISTERED","assertions":["missing rule fails closed"]},
    {"oracle_id":"OR-V17-027","outcome":"stopped","resolution_status":"invalid","value_origin":null,"effective_value":null,"stop_code":"DIRECTED_SEGMENT_LINEAGE_INVALID","assertions":["start index must be less than end index"]},
    {"oracle_id":"OR-V17-028","outcome":"stopped","resolution_status":"unresolved","value_origin":null,"effective_value":null,"stop_code":"RELATION_DIRECTED_MAPPING_MISSING","assertions":["zero candidates stop"]},
    {"oracle_id":"OR-V17-029","outcome":"stopped","resolution_status":"conflict","value_origin":null,"effective_value":null,"stop_code":"RELATION_DIRECTED_MAPPING_AMBIGUOUS","assertions":["multiple candidates stop"]},
    {"oracle_id":"OR-V17-030","outcome":"stopped","resolution_status":"invalid","value_origin":null,"effective_value":null,"stop_code":"LANE_COUNT_INVALID","assertions":["moving lane count must be positive"]},
    {"oracle_id":"OR-V17-031","outcome":"stopped","resolution_status":"conflict","value_origin":null,"effective_value":null,"stop_code":"LANE_COUNT_CONFLICT","assertions":["total and directional counts disagree"]},
    {"oracle_id":"OR-V17-032","outcome":"stopped","resolution_status":"unresolved","value_origin":null,"effective_value":null,"stop_code":"LANE_DIRECTIONAL_ALLOCATION_MISSING","assertions":["formal even split is prohibited","odd and single-lane variants also stop"]},
    {"oracle_id":"OR-V17-033","outcome":"stopped","resolution_status":"conflict","value_origin":null,"effective_value":null,"stop_code":"LANE_VECTOR_LENGTH_MISMATCH","assertions":["vector length differs from directional count"]},
    {"oracle_id":"OR-V17-034","outcome":"stopped","resolution_status":"invalid","value_origin":null,"effective_value":null,"stop_code":"SPEED_VALUE_INVALID","assertions":["invalid speed is not normalized"]},
    {"oracle_id":"OR-V17-035","outcome":"stopped","resolution_status":"valid_but_unsupported","value_origin":null,"effective_value":null,"stop_code":"SPEED_VALUE_UNSUPPORTED","assertions":["valid source token lacks approved evaluator"]},
    {"oracle_id":"OR-V17-036","outcome":"stopped","resolution_status":"unresolved","value_origin":null,"effective_value":null,"stop_code":"SPEED_RULE_NOT_REGISTERED","assertions":["symbolic speed requires registered rule"]},
    {"oracle_id":"OR-V17-037","outcome":"stopped","resolution_status":"unresolved","value_origin":null,"effective_value":null,"stop_code":"SPEED_CONDITIONAL_CONTEXT_MISSING","assertions":["missing context is not false"]},
    {"oracle_id":"OR-V17-038","outcome":"stopped","resolution_status":"conflict","value_origin":null,"effective_value":null,"stop_code":"SPEED_WITHIN_INTERVAL_CHANGE","assertions":["speed is not averaged over interval"]},
    {"oracle_id":"OR-V17-039","outcome":"stopped","resolution_status":"invalid","value_origin":null,"effective_value":null,"stop_code":"ACCESS_VALUE_INVALID","assertions":["invalid access value stops"]},